[
 {
  "id": "2023r05-fe-kamoku-b-q01",
  "pool": "fe-koukai",
  "exam": {
   "year": 2023,
   "era": "令和5年度",
   "subject": "kamokuB",
   "legacySection": "公開問題"
  },
  "no": 1,
  "format": "text",
  "body": "次のプログラム中の aと bに入れる正しい答えの組合せを，解答群の中から選べ。ここで，配列の要素番号は 1 から始まる。関数 findPrimeNumbers は，引数で与えられた整数以下の，全ての素数だけを格納した配列を返す関数である。ここで，引数に与える整数は 2 以上である。〔プログラム〕○整数型の配列: findPrimeNumbers(整数型: maxNum)整数型の配列: pnList ← {} // 要素数0の配列整数型: i, j論理型: divideFlag for (i を 2 から aまで 1 ずつ増やす)divideFlag ← true/* iの正の平方根の整数部分が2未満のときは，繰返し処理を実行しない */for (j を 2 から iの正の平方根の整数部分 まで 1 ずつ増やす) // αif ( b)divideFlag ← falseαの行から始まる繰返し処理を終了するendif endfor if (divideFlag が true と等しい)pnListの末尾 に iの値 を追加するendif endfor return pnList解答群a b",
  "choices": {
   "ア": "maxNum i ÷ j の余り が 0 と等しい",
   "イ": "maxNum i ÷ j の商 が 1 と等しくない",
   "ウ": "maxNum ＋ 1 i ÷ j の余り が 0 と等しい",
   "エ": "maxNum ＋ 1 i ÷ j の商 が 1 と等しくない"
  },
  "answer": "ア",
  "source": {
   "label": "出典：令和5年度 基本情報技術者試験 公開問題 科目B 問1",
   "questionPdf": "https://www.ipa.go.jp/shiken/mondai-kaiotu/sg_fe/koukai/t6hhco0000003zx0-att/2023r05_fe_kamoku_b_qs.pdf",
   "answerPdf": "https://www.ipa.go.jp/shiken/mondai-kaiotu/sg_fe/koukai/t6hhco0000003zx0-att/2023r05_fe_kamoku_b_ans.pdf",
   "page": 4,
   "sha256": "04fc7d8dbeed2f29bb7082d24ecdc8712c78b39012de0813c6a11cd1c5eea25a"
  },
  "verified": true,
  "modified": false
 },
 {
  "id": "2023r05-fe-kamoku-b-q03",
  "pool": "fe-koukai",
  "exam": {
   "year": 2023,
   "era": "令和5年度",
   "subject": "kamokuB",
   "legacySection": "公開問題"
  },
  "no": 3,
  "format": "text",
  "body": "次の記述中の に入れる正しい答えを，解答群の中から選べ。ここで，配列の要素番号は 1 から始まる。次の手続 sort は，大域の整数型の配列 data の，引数 first で与えられた要素番号から引数 last で与えられた要素番号までの要素を昇順に整列する。ここで，first＜ last とする。手続 sort を sort(1, 5) として呼び出すと，/*** α ***/ の行を最初に実行したときの出力は“ ”となる。〔プログラム〕大域: 整数型の配列: data ← {2, 1, 3, 5, 4}○sort(整数型: first, 整数型: last)整数型: pivot, i, j pivot ← data[(first ＋ last) ÷ 2 の商]i ← first j ← last while (true)while (data[i] ＜ pivot)i ← i ＋ 1 endwhile while (pivot ＜ data[j])j ← j － 1 endwhile if (i ≧ j)繰返し処理を終了するendif data[i]とdata[j]の値を入れ替えるi ← i ＋ 1 j ← j － 1 endwhile dataの全要素の値を要素番号の順に空白区切りで出力する /*** α ***/if (first ＜ i － 1)sort(first, i － 1)endif if (j ＋ 1 ＜ last)sort(j ＋ 1, last)endif解答群",
  "choices": {
   "ア": "1 2 3 4 5",
   "イ": "1 2 3 5 4",
   "ウ": "2 1 3 4 5",
   "エ": "2 1 3 5 4"
  },
  "answer": "エ",
  "source": {
   "label": "出典：令和5年度 基本情報技術者試験 公開問題 科目B 問3",
   "questionPdf": "https://www.ipa.go.jp/shiken/mondai-kaiotu/sg_fe/koukai/t6hhco0000003zx0-att/2023r05_fe_kamoku_b_qs.pdf",
   "answerPdf": "https://www.ipa.go.jp/shiken/mondai-kaiotu/sg_fe/koukai/t6hhco0000003zx0-att/2023r05_fe_kamoku_b_ans.pdf",
   "page": 6,
   "sha256": "04fc7d8dbeed2f29bb7082d24ecdc8712c78b39012de0813c6a11cd1c5eea25a"
  },
  "verified": true,
  "modified": false
 },
 {
  "id": "2023r05-fe-kamoku-b-q04",
  "pool": "fe-koukai",
  "exam": {
   "year": 2023,
   "era": "令和5年度",
   "subject": "kamokuB",
   "legacySection": "公開問題"
  },
  "no": 4,
  "format": "text",
  "body": "次の記述中の に入れる正しい答えを，解答群の中から選べ。ここで，配列の要素番号は 1 から始まる。関数 add は，引数で指定された正の整数 value を大域の整数型の配列 hashArray に格納する。格納できた場合は true を返し，格納できなかった場合は false を返す。ここで，整数 value を hashArray のどの要素に格納すべきかを，関数 calcHash1 及びcalcHash2 を利用して決める。手続 test は，関数 add を呼び出して，hashArray に正の整数を格納する。手続test の処理が終了した直後の hashArray の内容は， である。〔プログラム〕大域: 整数型の配列: hashArray○論理型: add(整数型: value)整数型: i ← calcHash1(value)if (hashArray[i] ＝ －1)hashArray[i] ← value return true else i ← calcHash2(value)if (hashArray[i] ＝ －1)hashArray[i] ← value return true endif endif return false○整数型: calcHash1(整数型: value)return (value mod hashArrayの要素数) ＋ 1○整数型: calcHash2(整数型: value)return ((value ＋ 3) mod hashArrayの要素数) ＋ 1○test()hashArray ← {5個の －1}add(3)add(18)add(11)解答群",
  "choices": {
   "ア": "{－1, 3, －1, 18, 11}",
   "イ": "{－1, 11, －1, 3, －1}",
   "ウ": "{－1, 11, －1, 18, －1}",
   "エ": "{－1, 18, －1, 3, 11}オ {－1, 18, 11, 3, －1}"
  },
  "answer": "エ",
  "source": {
   "label": "出典：令和5年度 基本情報技術者試験 公開問題 科目B 問4",
   "questionPdf": "https://www.ipa.go.jp/shiken/mondai-kaiotu/sg_fe/koukai/t6hhco0000003zx0-att/2023r05_fe_kamoku_b_qs.pdf",
   "answerPdf": "https://www.ipa.go.jp/shiken/mondai-kaiotu/sg_fe/koukai/t6hhco0000003zx0-att/2023r05_fe_kamoku_b_ans.pdf",
   "page": 8,
   "sha256": "04fc7d8dbeed2f29bb7082d24ecdc8712c78b39012de0813c6a11cd1c5eea25a"
  },
  "verified": true,
  "modified": false
 },
 {
  "id": "2023r05-fe-kamoku-b-q05",
  "pool": "fe-koukai",
  "exam": {
   "year": 2023,
   "era": "令和5年度",
   "subject": "kamokuB",
   "legacySection": "公開問題"
  },
  "no": 5,
  "format": "text",
  "body": "次のプログラム中の aと bに入れる正しい答えの組合せを，解答群の中から選べ。ここで，配列の要素番号は 1 から始まる。コサイン類似度は，二つのベクトルの向きの類似性を測る尺度である。関数calcCosineSimilarity は，いずれも要素数が n(n≧1) である実数型の配列 vector1と vector2 を受け取り，二つの配列のコサイン類似度を返す。配列 vector1 が {a1,a2, …, an}，配列 vector2 が {b1, b2, …, bn} のとき，コサイン類似度は次の数式で計算される。ここで，配列 vector1 と配列 vector2 のいずれも，全ての要素に 0 が格納されていることはないものとする。a1b1 ＋ a2b2 ＋ … ＋ anbn a1＋ a2＋ … ＋ anb1＋ b2＋ … ＋ bn〔プログラム〕○実数型: calcCosineSimilarity(実数型の配列: vector1,実数型の配列: vector2)実数型: similarity, numerator, denominator, temp ← 0整数型: i numerator ← 0 for (i を 1 から vector1の要素数 まで 1 ずつ増やす)numerator ← numerator ＋a endfor for (i を 1 から vector1の要素数 まで 1 ずつ増やす)temp ← temp ＋ vector1[i]の2乗endfor denominator ← tempの正の平方根temp ← 0 for (i を 1 から vector2の要素数 まで 1 ずつ増やす)temp ← temp ＋ vector2[i]の2乗endfor denominator ←b similarity ← numerator ÷ denominator return similarity解答群a b(vector1[i] × vector2[i])の正の",
  "choices": {
   "ア": "denominator × (tempの正の平方根)平方根(vector1[i] × vector2[i])の正の",
   "イ": "denominator ＋ (tempの正の平方根)平方根(vector1[i] × vector2[i])の正の",
   "ウ": "tempの正の平方根平方根",
   "エ": "vector1[i] × vector2[i] denominator × (tempの正の平方根)オ vector1[i] × vector2[i] denominator ＋ (tempの正の平方根)カ vector1[i] × vector2[i] tempの正の平方根キ vector1[i]の2乗 denominator × (tempの正の平方根)ク vector1[i]の2乗 denominator ＋ (tempの正の平方根)ケ vector1[i]の2乗 tempの正の平方根"
  },
  "answer": "エ",
  "source": {
   "label": "出典：令和5年度 基本情報技術者試験 公開問題 科目B 問5",
   "questionPdf": "https://www.ipa.go.jp/shiken/mondai-kaiotu/sg_fe/koukai/t6hhco0000003zx0-att/2023r05_fe_kamoku_b_qs.pdf",
   "answerPdf": "https://www.ipa.go.jp/shiken/mondai-kaiotu/sg_fe/koukai/t6hhco0000003zx0-att/2023r05_fe_kamoku_b_ans.pdf",
   "page": 10,
   "sha256": "04fc7d8dbeed2f29bb7082d24ecdc8712c78b39012de0813c6a11cd1c5eea25a"
  },
  "verified": true,
  "modified": false
 },
 {
  "id": "2023r05-fe-kamoku-b-q06",
  "pool": "fe-koukai",
  "exam": {
   "year": 2023,
   "era": "令和5年度",
   "subject": "kamokuB",
   "legacySection": "公開問題"
  },
  "no": 6,
  "format": "text",
  "body": "A 社は，放送会社や運輸会社向けに広告制作ビジネスを展開している。A 社は，人事業務の効率化を図るべく，人事業務の委託を検討することにした。A 社が委託する業務（以下，B 業務という）を図 1 に示す。・採用予定者から郵送されてくる入社時の誓約書，前職の源泉徴収票などの書類を PDF ファイルに変換し，ファイルサーバに格納する。（省略）図 1 B 業務委託先候補の C 社は，B 業務について，次のように A 社に提案した。・B 業務だけに従事する専任の従業員を割り当てる。・B 業務では，図 2 の複合機のスキャン機能を使用する。・スキャン機能を使用する際は，従業員ごとに付与した利用者 ID とパスワードをパネルに入力する。・スキャンしたデータを PDF ファイルに変換する。・PDF ファイルを従業員ごとに異なる鍵で暗号化して，電子メールに添付する。・スキャンを実行した本人宛てに電子メールを送信する。・PDF ファイルが大きい場合は，PDF ファイルを添付する代わりに，自社の社内ネットワーク上に設置したサーバ（以下，B サーバという）に自動的に保存し，保存先の URL を電子メールの本文に記載して送信する。注 B サーバにアクセスする際は，従業員ごとの利用者 ID とパスワードが必要になる。図 2 複合機のスキャン機能（抜粋）A 社は，C 社と業務委託契約を締結する前に，秘密保持契約を締結した。その後，C社に質問表を送付し，回答を受けて，業務委託での情報セキュリティリスクの評価を実施した。その結果，図 3 の発見があった。・複合機のスキャン機能では，電子メールの差出人アドレス，件名，本文及び添付ファイル名を初期設定 の状態で使用しており，誰がスキャンを実行しても同じである。・複合機のスキャン機能の初期設定情報はベンダーの Web サイトで公開されており，誰でも閲覧できる。注 複合機の初期設定は C 社の情報システム部だけが変更可能である。図 3 発見事項そこで，A 社では，初期設定の状態のままでは A 社にとって情報セキュリティリスクがあり，初期設定から変更するという対策が必要であると評価した。設問 対策が必要であると A 社が評価した情報セキュリティリスクはどれか。解答群のうち，最も適切なものを選べ。解答群",
  "choices": {
   "ア": "B 業務に従事する従業員が，攻撃者からの電子メールを複合機からのものと信じて本文中にある URL をクリックし，フィッシングサイトに誘導される。その結果，A 社の採用予定者の個人情報が漏えいする。",
   "イ": "B 業務に従事する従業員が，複合機から送信される電子メールをスパムメールと誤認し，電子メールを削除する。その結果，再スキャンが必要となり，B 業務が遅延する。",
   "ウ": "攻撃者が，複合機から送信される電子メールを盗聴し，添付ファイルを暗号化して身代金を要求する。その結果，A 社が復号鍵を受け取るために多額の身代金を支払うことになる。",
   "エ": "攻撃者が，複合機から送信される電子メールを盗聴し，本文に記載されているURL を使って B サーバにアクセスする。その結果，A 社の採用予定者の個人情報が漏えいする。〔 メ モ 用 紙 〕〔 メ モ 用 紙 〕試験問題に記載されている会社名又は製品名は，それぞれ各社の商標又は登録商標です。TM ®なお，試験問題では，及び を明記していません。"
  },
  "answer": "ア",
  "source": {
   "label": "出典：令和5年度 基本情報技術者試験 公開問題 科目B 問6",
   "questionPdf": "https://www.ipa.go.jp/shiken/mondai-kaiotu/sg_fe/koukai/t6hhco0000003zx0-att/2023r05_fe_kamoku_b_qs.pdf",
   "answerPdf": "https://www.ipa.go.jp/shiken/mondai-kaiotu/sg_fe/koukai/t6hhco0000003zx0-att/2023r05_fe_kamoku_b_ans.pdf",
   "page": 12,
   "sha256": "04fc7d8dbeed2f29bb7082d24ecdc8712c78b39012de0813c6a11cd1c5eea25a"
  },
  "verified": true,
  "modified": false
 }
]